{
  "schema_version": "1.0.0",
  "message_id": "msg-0100",
  "kind": "command",
  "priority": "control",
  "command_id": "cmd-0090",
  "source": {
    "hardware_id": "srv-ubuntu-a",
    "session_id": "sess-srv",
    "seq_local": 331
  },
  "target": {
    "kind": "node",
    "value": "servo-zone-a"
  },
  "delivery": {
    "route_class": "immediate_local",
    "allow_relay": false,
    "allow_redundant": false,
    "hop_limit": 0
  },
  "payload": {
    "command_name": "servo.set_angle",
    "angle_deg": 120,
    "expires_at_ms": 1500
  }
}
