{
  "schema_version": "1.0.0",
  "message_id": "msg-command-sleepy-maint-001",
  "kind": "command",
  "priority": "control",
  "command_id": "cmd-sleepy-maint-001",
  "occurred_at": "2099-04-23T08:03:00+00:00",
  "source": {
    "hardware_id": "controller-client-01",
    "session_id": "sess-controller-01",
    "seq_local": 6,
    "fabric_short_id": 401,
    "network_role": "controller_client"
  },
  "target": {
    "kind": "node",
    "value": "sleepy-leaf-01"
  },
  "delivery": {
    "route_class": "maintenance_sync",
    "allow_relay": false,
    "allow_redundant": false,
    "hop_limit": 0,
    "expires_at": "2099-04-23T08:30:00+00:00"
  },
  "payload": {
    "command_name": "diagnostics.upload",
    "service_level": "eventual_next_poll",
    "detail": "full"
  }
}
